skill_name,skill_link,skill_description
Ek bandar ne kholi dukan Indian rhyme,https://www.amazon.com/bandar-kholi-dukan-Indian-rhyme/dp/B0851ZLQ6J/ref=sr_1_89?dchild=1&qid=1624575121&rnid=14284832011&s=alexa-skills&sr=1-89,"Ek Bandar Ne Kholi Dukan"" is a Hindi Rhyme funny song. Enjoy Kids. We have updated the skill with a more smooth and fault-free experience. We are continuing the legacy of the previous skill with a more advanced and smooth voice experience. ek bandar ne kholi dukan Indian Rhyme will take you on an adventurous ride to the world of monkeys and their adventures. Whether it is time to sleep or dinner, play this rhyme for kids and your kid will love it. Steps for using the skill: Session 1: User: Alexa, open ek bandar Alexa: Starting ek bandar, you can say start or begin User: Start / Begin Alexa: Playing ek bandar User: Alexa, next User: Alexa, stop User: Alexa, shuffle User: Alexa, next / previous User: Alexa, resume User: Alexa, start over User: Yes/No Session 2: User: Alexa, open ek bandar Alexa: You were listening to ek bandar already, Would you like to resume? User: No Alexa: <Alexa starts over to play the audio from start> You are listening to the ek bandar rhyme. You can say, Next or Previous to navigate through the playlist. At any time, you can say Pause to pause the audio and Resume to resume. Session 3: User: Help Alexa: You are listening to the ek bandar. You can say, Next or Previous to navigate through the playlist. At any time, you can say Pause to pause the audio and Resume to resume. Once invoked, Alexa will automatically start the conversation and play the audio. Sit back, relax, and enjoy the rhyme of ek bandar. To start again on finishing one story, you can ask Alexa to open it again. When you reach the bottom of the playlist, try saying, Alexa, start over or Alexa, shuffle You can always pause, play, resume, start over, say next to play from start. The Alexa skill is specially designed for kids of age group 4-13 years old. For all users in India and the rest parts of the world, the skill responses in Hindi audio.  ---------------------------------------------------------------------------------------------------------------------- Disclaimer ---------------------------------------------------------------------------------------------------------------------- “Ek bandar ne kholi dukan Indian rhyme skill for Amazon Alexa” contains audio in Indian local language ‘Hindi’. Users of this skill are fully aware of the local language and accepted to play the poem with their own knowledge and experience."
How Many Days,https://www.amazon.com/Mountain-Oasis-How-Many-Days/dp/B0852L4TR5/ref=sr_1_88?dchild=1&qid=1624575121&rnid=14284832011&s=alexa-skills&sr=1-88,Open the skill and Alexa will automatically tell you how many days remain until all your upcoming events. Alexa can also remind you about the exact date for a specific events. This skill was created using a Skill Blueprint. Your requests to this skill are not shared with the skill developer.
Bandar mama pehen pyajama Indian rhyme,https://www.amazon.com/Bandar-pehen-pyajama-Indian-rhyme/dp/B0855QYXSJ/ref=sr_1_86?dchild=1&qid=1624575121&rnid=14284832011&s=alexa-skills&sr=1-86,"""Bandar Mama Pehen Pyjama"" is a Hindi Rhyme funny song. Enjoy Kids. We have updated the skill with a more smooth and fault-free experience. We are continuing the legacy of the previous skill with a more advanced and smooth voice experience. bandar mama will take you on an adventurous ride to the jungle. Whether it is time to sleep or dinner, play this rhyme for kids and your kid will love it. Steps for using the skill: Session 1: User: Alexa, open bandar mama Alexa: Starting bandar mama, you can say start or begin User: Start / Begin Alexa: Playing bandar mama User: Alexa, next User: Alexa, stop User: Alexa, shuffle User: Alexa, next / previous User: Alexa, resume User: Alexa, start over User: Yes/No Session 2: User: Alexa, open bandar mama Alexa: You were listening to bandar mama already, Would you like to resume? User: No Alexa: <Alexa starts over to play the audio from start> You are listening to the bandar mama stories. You can say, Next or Previous to navigate through the playlist. At any time, you can say Pause to pause the audio and Resume to resume. Session 3: User: Help Alexa: You are listening to the bandar mama. You can say, Next or Previous to navigate through the playlist. At any time, you can say Pause to pause the audio and Resume to resume. Once invoked, Alexa will automatically start the conversation and play the audio. Sit back, relax, and enjoy the rhyme of bandar mama. To start again on finishing one story, you can ask Alexa to open it again. When you reach the bottom of the playlist, try saying, Alexa, start over or Alexa, shuffle"
Luca and Lily's adventure story,https://www.amazon.com/Luca-and-Lilys-adventure-story/dp/B0857L43C6/ref=sr_1_85?dchild=1&qid=1624575121&rnid=14284832011&s=alexa-skills&sr=1-85,Play an interactive adventure-themed story with sound effects and prompts. Get ready for laughs and giggles as players fill in the blanks. This skill was created using a Skill Blueprint. Your requests to this skill are not shared with the skill developer.
Cheeze Burger joke,https://www.amazon.com/LJDC-Cheeze-Burger-joke/dp/B085C9HXS8/ref=sr_1_84?dchild=1&qid=1624575121&rnid=14284832011&s=alexa-skills&sr=1-84,"Try these lighthearted jokes to add more fun to your day. When using the skill, you can say ""Alexa, next"" to move to the next joke. At any point, you can say ""Alexa, stop"" to exit the skill. This skill was created using a Skill Blueprint. Your requests to this skill are not shared with the skill developer."
Jades inspired,https://www.amazon.com/Jades-Quots-inspired/dp/B0852Z4JL6/ref=sr_1_87?dchild=1&qid=1624575121&rnid=14284832011&s=alexa-skills&sr=1-87,"Start your day with an inspirational list of quotes. When using the skill, you can say ""Alexa, next"" to move to the next quote. At any point, you can say ""Alexa, stop"" to exit the skill. This skill was created using a Skill Blueprint.  Your requests to this skill are not shared with the skill developer."
Sleep Sound: Cars Racing Sound for Pre-k,https://www.amazon.com/Sleep-Sound-Cars-Racing-Pre-k/dp/B084BXLMFZ/ref=sr_1_96?dchild=1&qid=1624575121&rnid=14284832011&s=alexa-skills&sr=1-96,"Sleep Sound: Cars Racing Sound for Pre-k Sleep Sound: Cars Racing Sound for Pre-k is a skill simulates the sound of a cars racing for your Kids. You can say: ""Alexa, open Cars Racing Sound"" ""Alexa, start Cars Racing Sound"" ""Alexa, launch Cars Racing Sound"""
Sleep Sounds: Rain On Tent Campfire Sounds,https://www.amazon.com/Sleep-Sounds-Rain-Tent-Campfire/dp/B084D59NGB/ref=sr_1_95?dchild=1&qid=1624575121&rnid=14284832011&s=alexa-skills&sr=1-95,"Sleep Sounds: Rain On Tent Campfire Sounds Rain On Tent Campfire Sounds helps you sleep peacefully or block out unwanted noise at work or home. You'll be able to sleep better, stay focused, study without interruption, relax quickly, meditate more effectively, and get your baby to go to sleep faster!"
Sleep Sounds: Tibetan Bowls,https://www.amazon.com/ganduss-works-Sleep-Sounds-Tibetan/dp/B084HFWS2J/ref=sr_1_93?dchild=1&qid=1624575121&rnid=14284832011&s=alexa-skills&sr=1-93,"Sleep Sounds: Tibetan Bowls Tibetan Bowls helps you sleep peacefully or block out unwanted noise at work or home. You'll be able to sleep better, stay focused, study without interruption, relax quickly, meditate more effectively, and get your baby to go to sleep faster!"
Sleep Sounds: Womb Sounds,https://www.amazon.com/ganduss-works-Sleep-Sounds-Womb/dp/B084H714Q8/ref=sr_1_94?dchild=1&qid=1624575121&rnid=14284832011&s=alexa-skills&sr=1-94,"Sleep Sounds: Womb Sounds Womb Sounds helps you sleep peacefully or block out unwanted noise at work or home. You'll be able to sleep better, stay focused, study without interruption, relax quickly, meditate more effectively, and get your baby to go to sleep faster!"
Sleep Sounds: Pink Noise,https://www.amazon.com/Muba-llc-Sleep-Sounds-Noise/dp/B084MDXTTL/ref=sr_1_92?dchild=1&qid=1624575121&rnid=14284832011&s=alexa-skills&sr=1-92,"Sleep Sounds: Pink Noise Pink Noise plays ambient sounds to help you sleep, relax, meditate, relieve stress, or block out unwanted noise."
Valentine's Greeting,https://www.amazon.com/Ethangeldhauser-Valentines-Greeting/dp/B084NY42N2/ref=sr_1_91?dchild=1&qid=1624575121&rnid=14284832011&s=alexa-skills&sr=1-91,Play a Valentine's Day greeting card for your loved one. This skill was created using a Skill Blueprint. Your requests to this skill are not shared with the skill developer.
Elephant Sounds,https://www.amazon.com/Muba-llc-Elephant-Sounds/dp/B084V1RWLP/ref=sr_1_90?dchild=1&qid=1624575121&rnid=14284832011&s=alexa-skills&sr=1-90,Elephant Sounds Have Alexa give you an elephant sound to brighten up your day!
Whose Turn,https://www.amazon.com/Karmen-Whose-Turn/dp/B085CCXCCJ/ref=sr_1_83?dchild=1&qid=1624575121&rnid=14284832011&s=alexa-skills&sr=1-83,"Next time you're trying to decide whose turn it is pick something or perform a task, just ask Alexa for help. For example, if you're trying to decide whose turn it is to pick a movie on movie night, Alexa can randomly select someone's name from the list. Or if you're trying to decide who should take out the trash, Alexa can help with that too!"
Chore chart,https://www.amazon.com/ISGToxic-Chore-chart/dp/B085CGV792/ref=sr_1_82?dchild=1&qid=1624575121&rnid=14284832011&s=alexa-skills&sr=1-82,"Use this skill to keep track of chores that are assigned to each member of your household. You can ask Alexa to read the list of chores that are assigned to you each day, and you can log your chores as you complete them. Alexa automatically keeps score so you can complete with family members to see who finishes their chores first. Or last! The chore tracker automatically resets on Sunday each week. This skill was created using a Skill Blueprint.  Your requests to this skill are not shared with the skill developer."
Whose Turn,https://www.amazon.com/Ruby-Whose-Turn/dp/B082ZHBP2Q/ref=sr_1_106?dchild=1&qid=1624575123&rnid=14284832011&s=alexa-skills&sr=1-106,"Next time you're trying to decide whose turn it is pick something or perform a task, just ask Alexa for help. For example, if you're trying to decide whose turn it is to pick a movie on movie night, Alexa can randomly select someone's name from the list. Or if you're trying to decide who should take out the trash, Alexa can help with that too!"
World's Best Dad,https://www.amazon.com/Ashley-Worlds-Best-Dad/dp/B082YVYN1N/ref=sr_1_107?dchild=1&qid=1624575123&rnid=14284832011&s=alexa-skills&sr=1-107,"Surprise your dad with an assortment of compliments. Simply say, ""Alexa, open World's Best Dad."" This skill was created using a Skill Blueprint. Your requests to this skill are not shared with the skill developer."
Whose Turn,https://www.amazon.com/Holly-Whose-Turn/dp/B08314Z5FW/ref=sr_1_105?dchild=1&qid=1624575123&rnid=14284832011&s=alexa-skills&sr=1-105,"Next time you're trying to decide whose turn it is pick something or perform a task, just ask Alexa for help. For example, if you're trying to decide whose turn it is to pick a movie on movie night, Alexa can randomly select someone's name from the list. Or if you're trying to decide who should take out the trash, Alexa can help with that too!"
UnpauseIt Podcast,https://www.amazon.com/UnpauseIt-Podcast/dp/B083BGRQHZ/ref=sr_1_102?dchild=1&qid=1624575123&rnid=14284832011&s=alexa-skills&sr=1-102,"UnpauseIt Podcast is a family of geeks - a dad, a mom, a son, and a daughter - who are here to review and rate today's entertainment for your family! UnpauseIt reviews movies, shows, video games, events, and experiences so your whole family can have a solid idea of how to enjoy life together.  Listen to our podcast reviews, and also check out our website for reviews, ratings, and lists at www.unpauseit.show. We'll also take your suggestions and recommendations for what you'd like us to try!"
How Many Days,https://www.amazon.com/Lesia-How-Many-Days/dp/B0834KF6ZH/ref=sr_1_103?dchild=1&qid=1624575123&rnid=14284832011&s=alexa-skills&sr=1-103,Open the skill and Alexa will automatically tell you how many days remain until all your upcoming events. Alexa can also remind you about the exact date for a specific events. This skill was created using a Skill Blueprint. Your requests to this skill are not shared with the skill developer.
New year Countdown,https://www.amazon.com/Kev-New-year-Countdown/dp/B0831KQCVT/ref=sr_1_104?dchild=1&qid=1624575123&rnid=14284832011&s=alexa-skills&sr=1-104,"Open the skill and ask Alexa for one of the pre-defined countdown timers. Alexa will read the into message and the countdown (10, 9, 8, ... 3, 2, 1), and then play a fun sound effect. This skill was created using a Skill Blueprint. Your requests to this skill are not shared with the skill developer."
Dad's Story,https://www.amazon.com/Ali-Anb-Dads-Story/dp/B083R7J2WW/ref=sr_1_101?dchild=1&qid=1624575123&rnid=14284832011&s=alexa-skills&sr=1-101,Listen to a personalized story that's all about dad and narrated by Alexa.
Pick someonewhose turn,https://www.amazon.com/Preet-Pick-someonewhose-turn/dp/B082H9KV9G/ref=sr_1_112?dchild=1&qid=1624575123&rnid=14284832011&s=alexa-skills&sr=1-112,"Next time you're trying to decide whose turn it is pick something or perform a task, just ask Alexa for help. For example, if you're trying to decide whose turn it is to pick a movie on movie night, Alexa can randomly select someone's name from the list. Or if you're trying to decide who should take out the trash, Alexa can help with that too!"
Old MacDonald had a farm E.I.E.I.O.,https://www.amazon.com/Old-MacDonald-had-farm-I/dp/B082KBHSJD/ref=sr_1_111?dchild=1&qid=1624575123&rnid=14284832011&s=alexa-skills&sr=1-111,"Old MacDonald had a farm Ee i ee i o And on his farm he had some cows Ee i ee i oh With a moo-moo here And a moo-moo there Here a moo, there a moo Everywhere a moo-moo Old MacDonald had a farm Ee i ee i o Old MacDonald had a farm Ee i ee i o And on his farm he had some chicks Ee i ee i o With a cluck-cluck here And a cluck-cluck there Here a cluck, there a cluck Everywhere a cluck-cluck Old MacDonald had a farm Ee i ee i o Old MacDonald had a farm Ee i ee i o And on his farm he had some pigs Ee i ee i o With an oink-oink here And an oink-oink there Here an oink, there an oink Everywhere an oink-oink Old MacDonald had a farm Ee i ee i o We have updated the skill with a more smooth and fault-free experience. We are continuing the legacy of the previous skill with a more advanced and smooth voice experience. old macdonald had a farm Indian Rhyme will take you on an adventurous ride to the famous old macdonald had a farm right from your home. Whether it is time to sleep or dinner, play this rhyme for kids and your kid will love it. Steps for using the skill: Session 1: User: Alexa, open old rhyme Alexa: Starting old macdonald had a farm, you can say start or begin User: Start / Begin Alexa: Playing old macdonald had a farm User: Alexa, next User: Alexa, stop User: Alexa, shuffle User: Alexa, next / previous User: Alexa, resume User: Alexa, start over User: Yes/No Session 2: User: Alexa, open old rhyme Alexa: You were listening to old macdonald had a farm already, Would you like to resume? User: No Alexa: <Alexa starts over to play the audio from start> You are listening to the old macdonald had a farm rhyme. You can say, Next or Previous to navigate through the playlist. At any time, you can say Pause to pause the audio and Resume to resume. Session 3: User: Help Alexa: You are listening to the old macdonald had a farm. You can say, Next or Previous to navigate through the playlist. At any time, you can say Pause to pause the audio and Resume to resume. Once invoked, Alexa will automatically start the conversation and play the audio. Sit back, relax, and enjoy the rhyme of old macdonald had a farm. To start again on finishing one story, you can ask Alexa to open it again. When you reach the bottom of the playlist, try saying, Alexa, start over or Alexa, shuffle"
Sue's Story,https://www.amazon.com/Angie-Sues-Story/dp/B082QRTMS6/ref=sr_1_109?dchild=1&qid=1624575123&rnid=14284832011&s=alexa-skills&sr=1-109,Listen to a personalized story that's all about mom and narrated by Alexa.
Jingle Bells,https://www.amazon.com/GOKULADIVYA-K-Jingle-Bells/dp/B082MMJ2M3/ref=sr_1_110?dchild=1&qid=1624575123&rnid=14284832011&s=alexa-skills&sr=1-110,"Welcome to Jingle Bells Song.  This skill allows you to play jingle bells song which engages all kids together to dance with the song and to celebrate merry christmas . Just say 'open jingle bells' to play this skill. You can say 'stop' anytime during the playback to stop. If you love this skill, please let us know by giving us your rating! We'd love to hear from you! If you have questions, comments, or feedback, please e-mail us at encoreideas08@gmail.com"
Personal Trainer,https://www.amazon.com/Serenity-ward-Personal-Trainer/dp/B082QSH2ZZ/ref=sr_1_108?dchild=1&qid=1624575123&rnid=14284832011&s=alexa-skills&sr=1-108,"Work out with Alexa throughout the week. Once you open the skill, just ask Alexa to start the workout. You can also ask Alexa for your progress. This skill was created using a Skill Blueprint. Your requests to this skill are not shared with the skill developer."
Happy Birthday,https://www.amazon.com/Jacob-Kirsh-Happy-Birthday/dp/B083S7Q3Y8/ref=sr_1_100?dchild=1&qid=1624575123&rnid=14284832011&s=alexa-skills&sr=1-100,"Celebrate special occasions with your loved ones. When you open the skill, Alexa will play a slideshow with rich images and audio. You can say ""Alexa, stop"" to exit anytime."
Task Tracker,https://www.amazon.com/Laura-ingles-Task-Tracker/dp/B083TP52K3/ref=sr_1_99?dchild=1&qid=1624575123&rnid=14284832011&s=alexa-skills&sr=1-99,Try these checklists to help you stay organized. This skill was created using a Skill Blueprint. Your requests to this skill are not shared with the skill developer.
Whose Turn,https://www.amazon.com/illeagalguy-Whose-Turn/dp/B0842QL5GD/ref=sr_1_98?dchild=1&qid=1624575123&rnid=14284832011&s=alexa-skills&sr=1-98,"Next time you're trying to decide whose turn it is pick something or perform a task, just ask Alexa for help. For example, if you're trying to decide whose turn it is to pick a movie on movie night, Alexa can randomly select someone's name from the list. Or if you're trying to decide who should take out the trash, Alexa can help with that too!"
Matthew Birthday Wishes,https://www.amazon.com/Alexa-Blueprints-User-Matthew-Birthday/dp/B0845RRD1Q/ref=sr_1_97?dchild=1&qid=1624575123&rnid=14284832011&s=alexa-skills&sr=1-97,"Celebrate special occasions with your loved ones. When you open the skill, Alexa will play a slideshow with rich images and audio. You can say ""Alexa, stop"" to exit anytime."
days list,https://www.amazon.com/the_saver-days-list/dp/B07ZKGNB8K/ref=sr_1_120?dchild=1&qid=1624575124&rnid=14284832011&s=alexa-skills&sr=1-120,Open the skill and Alexa will automatically tell you how many days remain until all your upcoming events. Alexa can also remind you about the exact date for a specific events. This skill was created using a Skill Blueprint. Your requests to this skill are not shared with the skill developer.
Rylee's Sleep Sounds,https://www.amazon.com/LC-Publishing-Rylees-Sleep-Sounds/dp/B07ZKHGXDB/ref=sr_1_119?dchild=1&qid=1624575124&rnid=14284832011&s=alexa-skills&sr=1-119,"Rylee has selected a sample of her favorite sleep sounds so that she doesn't keep her parents up at night!  This skill is super simple to use. My goal was to create something that would be really easy to use and avoid excess speaking while doing exactly what it is supposed to do: namely, play sleeping sounds for babies, children, or adults!  1) Say next or previous to choose sounds.   - The skill will remember your most recent selection when relaunching. 2) Say turn whisper on or off.  - It will remember your settings whenever you launch so you don't wake your baby up. 3) Say loop on or loop off.  - It will remember your settings and continually loop your current selection. 4) Say play (sound name).  - Jump right to the sound you like. And that is it! Here are the sounds: - Rain - Ambiance - Drone - Vacuum - Stream - River - Fan - Hallway Fan - Thunder I'll keep adding new and different sounds over time so keep your eyes out for those! I know that there are tons of similar offerings out there, but my goal with this was to cut down on the verbiage and sales pitches and get right to the sounds."
Mighty Series Radio,https://www.amazon.com/Radio-co-Mighty-Series-Radio/dp/B0827DS5Y5/ref=sr_1_113?dchild=1&qid=1624575124&rnid=14284832011&s=alexa-skills&sr=1-113,"Upbeat, Uplifting messages and music to encourage your child's walk with the Lord"
Whose Turn,https://www.amazon.com/farco-Whose-Turn/dp/B081ZTS3CN/ref=sr_1_115?dchild=1&qid=1624575124&rnid=14284832011&s=alexa-skills&sr=1-115,"Next time you're trying to decide whose turn it is pick something or perform a task, just ask Alexa for help. For example, if you're trying to decide whose turn it is to pick a movie on movie night, Alexa can randomly select someone's name from the list. Or if you're trying to decide who should take out the trash, Alexa can help with that too!"
Descendants Challenge,https://www.amazon.com/Disney-Descendants-Challenge/dp/B07ZRVZP75/ref=sr_1_118?dchild=1&qid=1624575124&rnid=14284832011&s=alexa-skills&sr=1-118,"The Descendants Challenge is the official Disney Descendants music trivia game that tests your knowledge of the music, lyrics and characters from the hit Disney Channel franchise, Descendants!  Can you name each song that Mal or Evie sings? Do you know every word to Audrey’s “Queen of Mean”? We’re gonna break this down. This trivia game will put your knowledge to the test to see who the biggest Disney Descendants fan is. Collect stars to compete with others on our daily and all-time leaderboards. It‘s going to be wickedly awesome. The Descendants Challenge is hosted by Evie herself, Sofia Carson. May the fiercest win. Your California Privacy Rights - https://privacy.thewaltdisneycompany.com/en/current-privacy-policy/your-california-privacy-rights/ Do Not Sell My Info - https://privacy.thewaltdisneycompany.com/en/dnsmi/ Children’s Online Privacy Policy - https://privacy.thewaltdisneycompany.com/en/for-parents/childrens-online-privacy-policy/"
Kids Christmas Songs,https://www.amazon.com/SamPaul-Skills-Kids-Christmas-Songs/dp/B081WLQXT7/ref=sr_1_116?dchild=1&qid=1624575124&rnid=14284832011&s=alexa-skills&sr=1-116,"Kids Christmas Songs - Christmas Sounds and Music Countdown Christmas Welcome to Kids Christmas Songs. This skill contains new and popular Christmas songs like 12 Days of Christmas, Up on The Housetop, Jingle Bell, We Wish a Merry Christmas and so on This Christmas sounds will inspire you and your kids for Christmas. Enjoy! This skill was built with love by VoiceApps.com.  Visit us to create your own skill in minutes!"
Do re mi,https://www.amazon.com/edodev-Do-re-mi/dp/B0813T48PH/ref=sr_1_117?dchild=1&qid=1624575124&rnid=14284832011&s=alexa-skills&sr=1-117,"Use ""Do re mi"" to listen and learn music notes. This simple skill plays the notes of the 4th octave as if they were played by a piano. The 4th octave is where A 440 Hz is located, which is the usual note used to tune instruments."
Dog sounds,https://www.amazon.com/Personal-Dog-sounds/dp/B07Y9HV7F4/ref=sr_1_127?dchild=1&qid=1624575124&rnid=14284832011&s=alexa-skills&sr=1-127,"Dog sounds play the sound of a dog in your Alexa device. To start using dog sounds in Alexa device just enable the skill in Alexa and say, Alexa, play dog sounds. If you enjoy the skill, please do leave us a review as it helps other people find it and enjoy the skill too"
Animal Sounds,https://www.amazon.com/arun-rajora-Animal-Sounds/dp/B07Y9TSWP3/ref=sr_1_126?dchild=1&qid=1624575124&rnid=14284832011&s=alexa-skills&sr=1-126,Listen to some cool animal sounds and try identifying them.
Ocean sounds,https://www.amazon.com/Personal-Ocean-sounds/dp/B07Y89BCHJ/ref=sr_1_128?dchild=1&qid=1624575124&rnid=14284832011&s=alexa-skills&sr=1-128,"Ocean sounds play the sound of the ocean in your Alexa device. To start using ocean sounds in Alexa device just enable the skill in Alexa and say, Alexa, play ocean sounds. If your facing any issues or need any improvements to the skill, please leave valuable feedback to us so it will really help us in updating the skill or leave us a review if you're enjoying our skill so it would help us in reaching a larger audience."
Beach sounds,https://www.amazon.com/Personal-Beach-sounds/dp/B07YQT4TKN/ref=sr_1_122?dchild=1&qid=1624575124&rnid=14284832011&s=alexa-skills&sr=1-122,"Beach sounds play the sound of the beach in your Alexa device. To start using beach sounds in Alexa device just enable the skill in Alexa and say, Alexa, Play beach sounds. If you enjoy the skill, please do leave us a review as it helps other people find it and enjoy the skill too"
test podcast,https://www.amazon.com/Bizapz-test-podcast/dp/B07Y9Z6V1Q/ref=sr_1_125?dchild=1&qid=1624575124&rnid=14284832011&s=alexa-skills&sr=1-125,podcast test
Cat sounds,https://www.amazon.com/Personal-Cat-sounds/dp/B07YD7DRHL/ref=sr_1_124?dchild=1&qid=1624575124&rnid=14284832011&s=alexa-skills&sr=1-124,"Cat sounds play the sound of a cat in your Alexa device. To start using cat sounds in Alexa device just enable the skill in Alexa and say, Alexa, play cat sounds. If you enjoy the skill, please do leave us a review as it helps other people find it and enjoy the skill too"
