skill_name,skill_link,skill_description
Thinking of You,https://www.amazon.com/Michelle-Mom-Thinking-of-You/dp/B07YKSKH1D/ref=sr_1_123?dchild=1&qid=1624575124&rnid=14284832011&s=alexa-skills&sr=1-123,"Celebrate special occasions with your loved ones. When you open the skill, Alexa will play a slideshow with rich images and audio. You can say ""Alexa, stop"" to exit anytime."
Thunderstorm sounds,https://www.amazon.com/Personal-Thunderstorm-sounds/dp/B07YWC3CG4/ref=sr_1_121?dchild=1&qid=1624575124&rnid=14284832011&s=alexa-skills&sr=1-121,"Thunderstorm sounds play the sound of a thunderstorm in your Alexa device. To start using thunderstorm sounds in Alexa device just enable the skill in Alexa and say, Alexa, Play thunderstorm sounds. If you enjoy the skill, please do leave us a review as it helps other people find it and enjoy the skill too"
Rain sounds,https://www.amazon.com/Personal-Rain-sounds/dp/B07Y55WRMG/ref=sr_1_129?dchild=1&qid=1624575126&rnid=14284832011&s=alexa-skills&sr=1-129,"Rain sounds play the sound of rain in your Alexa device. To start using rain sounds in Alexa device just enable the skill in Alexa and say, Alexa, play rain sounds. If you enjoy the skill, please do leave us a review as it helps other people find it and enjoy the skill too"
Mom's Story,https://www.amazon.com/Talya-Burke-Moms-Story/dp/B08222TV3N/ref=sr_1_114?dchild=1&qid=1624575124&rnid=14284832011&s=alexa-skills&sr=1-114,Listen to a personalized story that's all about mom and narrated by Alexa.
My Daily Story,https://www.amazon.com/Xist-Publishing-My-Daily-Story/dp/B07V6VZ2YW/ref=sr_1_144?dchild=1&qid=1624575126&rnid=14284832011&s=alexa-skills&sr=1-144,"Help your kids build a lifetime love of reading with free audiobook stories from children's publisher, Xist Publishing.   Our mission is to create books that inspire discovery and delight in toddlers through ten-year-olds.  We're committed to sharing stories with kids that will help them grow into kind and curious individuals who love reading, no matter what form it takes.   Each day, your children can listen to one of our audiobook story editions. We provide a wide selection of stories for kids from 3-10 featuring fiction and non-fiction texts.   All of these stories are suitable for bedtime, car rides, rest time, nap time and more.   Each story has been professionally recorded to give your kids an ideal listening experience.  All of our books are also available in paperback and Kindle editions. Kids can read along with our books on Kindles or other devices."
Dhol Radio,https://www.amazon.com/RaaviKaran-Dhol-Radio/dp/B07VWS9477/ref=sr_1_141?dchild=1&qid=1624575126&rnid=14284832011&s=alexa-skills&sr=1-141,Listen to the live stream of famous punjabi dhol radio from its official website. This skill is not official from dhol radio.
Twinkle Twinkle Little Star - Indian Rhyme,https://www.amazon.com/Twinkle-Star-Most-Famous-Rhyme/dp/B07VPCR9DT/ref=sr_1_143?dchild=1&qid=1624575126&rnid=14284832011&s=alexa-skills&sr=1-143,"We have updated the skill with a more smooth and fault-free experience. We are continuing the legacy of the previous skill with a more advanced and smooth voice experience. Twinkle Star will take you on an adventurous ride to the moon. Whether it is time to sleep or dinner, play this rhyme for kids and your kid will love it. Steps for using the skill: Session 1: User: Alexa, open twinkle star Alexa: Starting twinkle star, you can say start or begin User: Start / Begin Alexa: Playing Twinkle Star User: Alexa, next User: Alexa, stop User: Alexa, shuffle User: Alexa, next / previous User: Alexa, resume User: Alexa, start over User: Yes/No Session 2: User: Alexa, open twinkle star Alexa: You were listening to twinkle star already, Would you like to resume? User: No Alexa: <Alexa starts over to play the audio from start> You are listening to the Twinkle Star stories. You can say, Next or Previous to navigate through the playlist. At any time, you can say Pause to pause the audio and Resume to resume. Session 3: User: Help Alexa: You are listening to the Twinkle Star. You can say, Next or Previous to navigate through the playlist. At any time, you can say Pause to pause the audio and Resume to resume. Once invoked, Alexa will automatically start the conversation and play the audio. Sit back, relax, and enjoy the rhyme of Twinkle Twinkle Star. To start again on finishing one story, you can ask Alexa to open it again. When you reach the bottom of the playlist, try saying, Alexa, start over or Alexa, shuffle"
Cuentos de Clan,https://www.amazon.com/Corporaci%C3%B3n-RTVE-Clan-Tales/dp/B07VV4YN8V/ref=sr_1_142?dchild=1&qid=1624575126&rnid=14284832011&s=alexa-skills&sr=1-142,"Los “Cuentos de Clan” es una skill interactiva con 100 cuentos para todos los gustos: de fantasía, de animales, de travesuras, historias divertidas o fábulas del mundo. Los niños y niñas pueden pedirle al asistente virtual qué cuento quieren escuchar y repetir sus favoritos de manera sencilla e intuitiva. De día, el asistente contará dos cuentos seguidos, y de noche, uno ideal para ir a la cama.  Los “Cuentos de Clan” nace de las narraciones de Esther de Lorenzo para Radio 5 de RTVE y han sido cuidadosamente seleccionados para ofrecer un aporte educativo y equilibrado a los niños y niñas.  De una forma tan sencilla como pedir ‘Alexa, abre Cuentos de Clan’, empieza una experiencia virtual en la que brujas, ogros, madrastras y lobos nos harán pensar y reflexionar a lo largo de 100 historietas originales.  Una vez haya empezado el cuento, de unos 4 minutos de duración, nuestro joven oyente podrá parar, seguir, salir o bien cambiar de cuento mediante sencillos comandos como “Alexa pausa” o “Alexa continua”.  Y tras el colorín colorado hay mucho más. Con solo decir “Alexa, quiero otro Cuento de Clan”, la experiencia empezará otra vez con más cuentos por descubrir y disfrutar."
Best Rhymes,https://www.amazon.com/Ashish-Best-Rhymes/dp/B07VX7LVPK/ref=sr_1_140?dchild=1&qid=1624575126&rnid=14284832011&s=alexa-skills&sr=1-140,"Let your kids enjoy listening to the most popular nursery rhymes of all times. A selection of most popular and melodious rhymes to keep your kids enthralled. Listening to these will help improve their imagination, concentration and focus.  HOW TO USE Before first use, enable the skill by pressing the Enable button in the Skill Store, then say ""Alexa, open best rhymes"" to begin. To finish, say ""Alexa, stop"". Got a distraction or need a break? No problem. Simply say 'Alexa, Pause' and resume listening to the playlist when you return by saying 'Alexa, Resume'.  To move to next or previous song, you can say 'Alexa, Next', or 'Alexa, Previous' ."
My name's Ishmael,https://www.amazon.com/Ish-My-names-Ishmael/dp/B07W5B9YV2/ref=sr_1_139?dchild=1&qid=1624575126&rnid=14284832011&s=alexa-skills&sr=1-139,"Next time you're trying to decide whose turn it is pick something or perform a task, just ask Alexa for help. For example, if you're trying to decide whose turn it is to pick a movie on movie night, Alexa can randomly select someone's name from the list. Or if you're trying to decide who should take out the trash, Alexa can help with that too!"
Matteo's Story,https://www.amazon.com/Matteo-Wible-Matteos-Story/dp/B07WC2R5DG/ref=sr_1_138?dchild=1&qid=1624575126&rnid=14284832011&s=alexa-skills&sr=1-138,"Welcome to MSJ Remember, This Skill Comes With The Book So This Is The First Part Of MSJ So Enable This Skill Cause It Is The ""Chapter 1"" Skill."
Born Superhero,https://www.amazon.com/Matteo-Wible-Born-Superhero/dp/B07WC2Y2FR/ref=sr_1_137?dchild=1&qid=1624575126&rnid=14284832011&s=alexa-skills&sr=1-137,"Ready To Hear An Adventure Story, Good Enable This Skill To Use It."
Event Tracker,https://www.amazon.com/Wallace-Roger-Awuku-Event-Tracker/dp/B07WG7KTF8/ref=sr_1_135?dchild=1&qid=1624575126&rnid=14284832011&s=alexa-skills&sr=1-135,Open the skill and Alexa will automatically tell you how many days remain until all your upcoming events. Alexa can also remind you about the exact date for a specific events. This skill was created using a Skill Blueprint. Your requests to this skill are not shared with the skill developer.
My Inspirations,https://www.amazon.com/Josiah-My-Inspirations/dp/B07WXLQM4F/ref=sr_1_133?dchild=1&qid=1624575126&rnid=14284832011&s=alexa-skills&sr=1-133,"Start your day with an inspirational list of quotes. When using the skill, you can say ""Alexa, next"" to move to the next quote. At any point, you can say ""Alexa, stop"" to exit the skill. This skill was created using a Skill Blueprint.  Your requests to this skill are not shared with the skill developer."
Which Day,https://www.amazon.com/Aditya-Kakde-Which-Day/dp/B07X13GD7V/ref=sr_1_132?dchild=1&qid=1624575126&rnid=14284832011&s=alexa-skills&sr=1-132,Open the skill and Alexa will automatically tell you how many days remain until all your upcoming events. Alexa can also remind you about the exact date for a specific events. This skill was created using a Skill Blueprint. Your requests to this skill are not shared with the skill developer.
Yo Rhymes,https://www.amazon.com/Ashish-Yo-Rhymes/dp/B07WQY8RZL/ref=sr_1_134?dchild=1&qid=1624575126&rnid=14284832011&s=alexa-skills&sr=1-134,"Let your kids enjoy listening to the most popular nursery rhymes of all times. A selection of most popular and melodious rhymes to keep your kids enthralled. Listening to these will help improve their imagination, concentration and focus.  HOW TO USE Before first use, enable the skill by pressing the Enable button in the Skill Store, then say ""Alexa, open Yo Rhymes"" to begin. To finish, say ""Alexa, stop"". Got a distraction or need a break? No problem. Simply say 'Alexa, Pause' and resume listening to the playlist when you return by saying 'Alexa, Resume'.  To move to next or previous song, you can say 'Alexa, Next', or 'Alexa, Previous' . List of Rhymes currently available:  ------------------------------------------- 1.  Baa Baa Black Sheep  2. Chubby Cheeks  3. Five Little Ducks  4. Goosey Goosey 5. Humpty Dumpty  6. Hickory Dickory Dock  7. Incy Wincy Spider  8. Johny Johny  9. Jack and Jill   10. London Bridge  11. Little Teapot  12. Mary had a little Lamb  13. Old MacDonald  14.One Two Buckle My Shoe  15. Rain Rain Go Away  16. Ring a Ring a roses  17. This is the way  18. The Grand   19. Three Blind Mice  20. Twinkle Twinkle  Every time you leave an encouraging review for this skill, you can request your favorite rhyme in comments and we would surely add to our playlist."
sanskrit shloka,https://www.amazon.com/SHREESH-sanskrit-shloka/dp/B07XRRVW7P/ref=sr_1_131?dchild=1&qid=1624575126&rnid=14284832011&s=alexa-skills&sr=1-131,"This is unique collection of Famous Sanskrit Shlokas with catchy music for children. You can play all the availables shloka in pre-defined order.  You can launch the skill with phrases like “Alexa, open sanskrit shloka” or “Alexa, start sanskrit shloka”, “Alexa, play sanskrit shloka”. You should be able to Pause & Resume the playing shloka and also navigate between Next and Previous shlokas. Currently available famous shlokas are: ""Vakratunda Mahakaya"" ""Karagre Vasate Lakshmi"" ""Gurubrahma Guruvishnu"" ""Udaye Brahmaroop"" ""Vasudevasutam"" ""Saraswati Namasthubhyam"" ""Ya Kundendu"" ""Manojavam"" ""Buddhir Balam"" ""Shuklambharadharam"""
Haathi Raja Kaha Chale - Indian Rhyme 🐘,https://www.amazon.com/Haathi-Raja-Kaha-Chale-Indian/dp/B07V5DWWQ3/ref=sr_1_145?dchild=1&qid=1624575128&rnid=14284832011&s=alexa-skills&sr=1-145,"Haathi Raja depicts an elephant that roams in the village and visits different villagers. People in the village ask the elephant to pay a visit to their houses and be their guests. Further villagers offer food and stay to the elephant. Elephants are considered sacred in the Great Indian History because of lord Ganesha. Hence all the villagers love the visit of the elephant ""Haathi Raja"" in their small village. The poem will take you to the magic world of the Haathi Raja.  The Alexa skill is specially designed for kids of the age group 4-13 years old. We have updated the skill with a more smooth and fault-free experience. We are continuing the legacy of the previous skill with a more advanced and smooth voice experience. Haathi Raja will take you on an adventurous ride to the village. Whether it is time to sleep or dinner, play this rhyme for kids and your kid will love it. Steps for using the skill: Session 1: User: Alexa, start haathi raja Alexa: Starting haathi raja, you can say start or begin User: Start / Begin Alexa: Playing haathi raja User: Alexa, next User: Alexa, stop User: Alexa, shuffle User: Alexa, next / previous User: Alexa, resume User: Alexa, start over User: Yes/No Session 2: User: Alexa, start haathi raja Alexa: You were listening to haathi raja already, Would you like to resume? User: No Alexa: <Alexa starts over to play the audio from start> You are listening to the haathi raja. You can say, Next or Previous to navigate through the playlist. At any time, you can say Pause to pause the audio and Resume to resume. Session 3: User: Help Alexa: You are listening to the haathi raja. You can say, Next or Previous to navigate through the playlist. At any time, you can say Pause to pause the audio and Resume to resume. Once invoked, Alexa will automatically start the conversation and play the audio. Sit back, relax, and enjoy the rhyme of haathi raja. To start again on finishing one story, you can ask Alexa to open it again by saying Alexa, start haathi raja When you reach the bottom of the playlist, try saying, Alexa, start over or Alexa, shuffle. However, all the audio are same which plays different versions of haathi raja."
Minute Lullabies,https://www.amazon.com/G-Services-Minute-Lullabies/dp/B07XSL3GDV/ref=sr_1_130?dchild=1&qid=1624575126&rnid=14284832011&s=alexa-skills&sr=1-130,Minute lullabies provide relaxing and calming lullabies to help your baby fall asleep faster. Our lullabies are about 1 minute long are meant to be as relaxing as possible. We appreciate any feedback or suggestions for our Skill!
KIDZ BOP Daily,https://www.amazon.com/KIDZ-BOP-Daily/dp/B07WFMXVJG/ref=sr_1_136?dchild=1&qid=1624575126&rnid=14284832011&s=alexa-skills&sr=1-136,"KIDZ BOP Daily is entertainment news by kids for kids! Each message features the latest KIDZ BOP news and fun facts for kids about music, pop culture and more! Check back in every day to make sure you don’t miss an update! Every day of the week has a theme: Motivation Monday, Tune-In Tuesday, Workout Wednesday, Throwback Thursday, Friday Favorite, Sing-It Saturday and Sunday Shout-outs. Follow all the KIDZ BOP news within Alexa’s Flash Briefing! After enabling this skill, say ”Alexa, play my Flash Briefing"" to hear your news.  Go to Settings in your Alexa app and find “Flash Briefing” to move KIDZ BOP Daily to the top of your news brief! If you enjoy KIDZ BOP Daily please leave us a review on your alexa app! Also, check out the KIDZ BOP Star game skill, where the KIDZ BOP Kids guide you through picking your pop star band name, learning dance moves, building a song and - putting on a show! Everyone's a star! Sound effects from ZapSplat"
L'Unico Podcast,https://www.amazon.com/crognali-it-LUnico-Podcast/dp/B07QDLN193/ref=sr_1_157?dchild=1&qid=1624575128&rnid=14284832011&s=alexa-skills&sr=1-157,L'Unico Podcast is your 1 minute news briefing on Design. Updated by architect and design. Interior designers tune in to A Well-Designed Business podcast. Let’s build a profitable firm. Decide to Be Excellent.
Mr. Murallo Casting,https://www.amazon.com/Witlingo-Mr-Murallo-Casting/dp/B07QMQ2P4W/ref=sr_1_156?dchild=1&qid=1624575128&rnid=14284832011&s=alexa-skills&sr=1-156,"Mr. Murallo is the 8th grade US History teacher of Cutler Arts & Humanities Magnet Middle School, and he will be using this Alexa skill to provide parents and students with regular updates on class activities. Cutler Middle School is part of Groton School District. We are a diverse, educational community of teachers and learners; educators, students, and staff.  Follow Groton School District on Twitter: @GrotonIB Find out more about Cutler Middle School here: https://www.grotonschools.org/cutler This skill was published using the Castlingo product by Witlingo.  For more on Castlingo, go to www.castlingo.com"
Kids Radio Australia,https://www.amazon.com/William-Dutton-Kids-Radio-Australia/dp/B07SBT69SC/ref=sr_1_154?dchild=1&qid=1624575128&rnid=14284832011&s=alexa-skills&sr=1-154,"Radio for Children and Families - Learn, play and sing along. Kids Radio provides a high quality sound 24/7 with the best kids music. To start, just say ""Alexa, launch kids radio"" or ""Alexa, play kids radio"" to start the radio"". At anytime, you can stop the radio by saying ""Alexa, stop"". Please be aware that radio station is in AEST (GMT+10) time This is an un-official skill to access the worldwide radio that https://radio.abc.net.au provides, more information can be found at https://radio.abc.net.au/help/streams (ABC KIDS listen) and yes, you can listen to this anywhere in the world, program content may change due to licences, please see this link for more information https://radio.abc.net.au/help/online/can-i-listen-if-i-m-not-in-australia"
Tatum's story,https://www.amazon.com/Jeremy-Brown-Tatums-story/dp/B07PQQNZ9Z/ref=sr_1_160?dchild=1&qid=1624575128&rnid=14284832011&s=alexa-skills&sr=1-160,Tatum wrote this story
blast off,https://www.amazon.com/Joy-Maiden-blast-off/dp/B07RYKZW52/ref=sr_1_155?dchild=1&qid=1624575128&rnid=14284832011&s=alexa-skills&sr=1-155,"Open the skill and ask Alexa for one of the pre-defined countdown timers. Alexa will read the into message and the countdown (10, 9, 8, ... 3, 2, 1), and then play a fun sound effect. This skill was created using a Skill Blueprint. Your requests to this skill are not shared with the skill developer."
Tooth Time,https://www.amazon.com/John-Marshall-Media-Tooth-Time/dp/B07Q4NGYZF/ref=sr_1_158?dchild=1&qid=1624575128&rnid=14284832011&s=alexa-skills&sr=1-158,"Tooth Time is full of songs and animations that kids can brush their teeth to! This skill helps teach how to change brushing quadrants every 30 seconds, and teach healthy dental habits as suggested by the ADA."
Cutler Middle School,https://www.amazon.com/Witlingo-Cutler-Middle-School/dp/B07PR3Y1SJ/ref=sr_1_159?dchild=1&qid=1624575128&rnid=14284832011&s=alexa-skills&sr=1-159,"Cutler Middle School is part of Groton School District. We are a diverse, educational community of teachers and learners; educators, students, and staff. You can ask this Alexa skill questions like, ""What are the school hours?"" ""Tell me about future events,"" ""Read me the newsletter"" and more. This skill was built using Buidlingo, a Witlingo product.  If you would like your very own Buildlingo skill, please visit http://www.witlingo.com/buildlingo/"
Mein Tota hare rang ka - Indian Rhyme,https://www.amazon.com/Mein-Tota-hare-rang-Indian/dp/B07SHNSWL8/ref=sr_1_153?dchild=1&qid=1624575128&rnid=14284832011&s=alexa-skills&sr=1-153,"Usage: Alexa, start mitthu mitthu ""Mein Tota hare rang ka - Indian Rhyme""   is a comfort to ears for kids. It will take you to the world of a parrot and its experiences. A parrot narrates the story of its life in a poem and tells about itself. How it looks like, what does it do, what does he eat, how a parrot repeats to its master thus called as an artist of nature. ""Mitthu Mitthu"" is the keyword to invoke the Alexa skill and thus the most fascinating word throughout the poem. The Alexa skill is specially designed for kids of age group 4-13 years old. English version (English): Alexa, start mitthu mitthu Hindi version (Hindi-India):   “Alexa, मिट्ठू मिट्ठू शुरू करो” We are continuously adding more and more handpicked stories and rhymes for kids which could bring more value to education among them and entertain them.  For all users in India and the rest parts of the world, the skill responses in Hindi audio.  ---------------------------------------------------------------------------------------------------------------------- Disclaimer ---------------------------------------------------------------------------------------------------------------------- Mein Tota hare rang ka - Indian Rhyme skill for Amazon Alexa contains audio in the Indian local language ‘Hindi’. Users of this skill are fully aware of the local language and accepted to play the poem with their own knowledge and experience."
Little Monkey,https://www.amazon.com/Supermann-Little-Monkey/dp/B07T41RCRW/ref=sr_1_150?dchild=1&qid=1624575128&rnid=14284832011&s=alexa-skills&sr=1-150,"Listen to this interactive story with a timeless lesson. At any point, you can say ""Alexa, stop"" to exit the skill. This skill was created using a Skill Blueprint. Your requests to this skill are not shared with the skill developer."
The Late Night,https://www.amazon.com/Crezia-technologies-The-Late-Night/dp/B07SJKTSHL/ref=sr_1_152?dchild=1&qid=1624575128&rnid=14284832011&s=alexa-skills&sr=1-152,"I tell you a secret, I sometimes walk on the dreamlike path, looking for the answers I couldn’t find in my routine life. The questions like Who and what are we? What vast universe we belong to? I don’t imagine the exact answers I can find to my own questions. I am Not eager to know what I am or what I am here to do What fascinates me more has to do with the people I love The once who were here and now they are gone, where have they gone my mind keeps asking The one who is here they are living, breathing, growing, I struggle to imagine why they are here and what brought them here But the once who are gone do they come back? It’s a puzzle that has no perfect answer whatever we know about ourselves may have no baring about what the universe knows. Today's poem is Late winter Night, The poem seems to share about the incident, that changed their life a father and son they fighting for life."
Daniel learns sharing,https://www.amazon.com/Supermann-Daniel-learns-sharing/dp/B07T41GWYG/ref=sr_1_151?dchild=1&qid=1624575128&rnid=14284832011&s=alexa-skills&sr=1-151,"Listen to this interactive story with a timeless lesson. At any point, you can say ""Alexa, stop"" to exit the skill. This skill was created using a Skill Blueprint. Your requests to this skill are not shared with the skill developer."
Dad's Story,https://www.amazon.com/Melissa-Dads-Story/dp/B07T69R6G7/ref=sr_1_148?dchild=1&qid=1624575128&rnid=14284832011&s=alexa-skills&sr=1-148,Listen to a personalized story that's all about dad and narrated by Alexa.
Canciones de cuna,https://www.amazon.com/Healing-fm-Lullabies/dp/B07T43F3FK/ref=sr_1_149?dchild=1&qid=1624575128&rnid=14284832011&s=alexa-skills&sr=1-149,"La Alexa Skill de canciones de cuna es perfecta para relajarte o ayudarte a dormir bien por la noche.  SOBRE HEALING FM En la agitada vida de hoy en día, las Skills de Healing FM están diseñadas para ayudarte a recargar tu alma, elevar tu espíritu y disfrutar de pequeños momentos de paz. Más de 1 millón personas al mes confían en las Skills de voz de alta calidad de Healing.fm para la meditación, la relajación y una buena noche de sueño.  COMENTARIOS DE SKILL Si te gusta usar esta Skill, danos una calificación. Gracias."
